identificationVerificationStatus,reps
validated by Smulders T./Schreurs,2
validated by Snauwaert B.,5
validated by Snauwaert G.,1
validated by Snauwaert M.,1
validated by Snoeckx T.,13
validated by Snyers C.,7
validated by Soors J.,650
validated by Soubry M.,28
validated by Souffreau C.,86
validated by Souffreau Caroline,1
validated by Souffreau J.,28
validated by Spanhove T.,1
validated by Speksnijder E.,14
validated by Sprengers K.,3
validated by Spruytte S.,44
validated by Staelens G-J.,1
validated by Staes L.,3
validated by Staes S.,9
validated by Stafford G.,1
validated by Standaert P.,4
validated by Stappers M.,1
validated by Stappers S.,2
validated by Starckx B.,3
validated by Stassen R.,16
validated by Steeman C.,5
validated by Steeman R.,10
validated by Steenman B.,4
validated by Steeno B.,7
validated by Sterckx M.,1
validated by Sterckx P.,1
validated by Stessens C.,42
validated by Steuperaert J. / Mel,39
validated by Steuperaert J./Mels,29
validated by Steuperaert-Mels J./,24
validated by Stevens G.,1
validated by Stevens I.,2
validated by Stevens R.,5
validated by Stijn Schreven,1
validated by Stip A.,11
validated by Stockx E.,2
validated by Stocman F.,3
validated by Stoks R.,1
validated by Stoops G.,124
validated by Strubbe R.,55
validated by Struyf K.,2
validated by Studenten Biowetensc,1
validated by Studiewerkgroep Land,2
validated by Sturtewagen W.,1
validated by Swaenen D.,9
validated by Swerts E.,1
validated by Swinnen V.,7
validated by Symens D.,15
validated by Symens P.,4
validated by Sytsma M.,1
validated by TAVERNI JM,1
validated by TAVIAUX B,14
validated by TERZO M,337
validated by THIRION C,1461
validated by Tack B.,1
validated by Tamsyn W.,59
validated by Taymans J.,11
validated by Teerlinck J.,1
validated by Temmerman H.,6
validated by Temmerman S.,20
validated by Terrana L.,4
validated by Terzo M,412
validated by Teunen J.,2
validated by Teunkens M.,1
validated by Theatre J-P.,3
validated by Theo Bollen,1
validated by Thibau K.,50
validated by Thibau S.,2
validated by Thibaut M.,3
validated by Thibiau K.,9
validated by Thiers K.,1
validated by Thiers S.,1
validated by Thijs K.,3
validated by Thirion C.,14
validated by Thirionet B.,2
validated by Thoen E.,1
validated by Thomas P.,1
validated by Thonissen K.,55
validated by Thonon P.,1
validated by Thornburn E.,1
validated by Thunus R.,1
validated by Thys J.,1
validated by Thys N.,42
validated by Thyssen  J.,5
validated by Thyssen J.,5
validated by Tibax E.,6
validated by Tielemans R.,1
validated by Tielens D.,1
validated by Tijs B,1
validated by Tkint T.,1
validated by Tolleneer P.,1
validated by Tom Didden,1
validated by Tom L.,10
validated by Tom Neels,1
validated by Tom Van Deuren,1
validated by Tombeur F.,2
validated by Tonincelli L.,1
validated by Toorman E.,48
validated by Tops K.,1
validated by Trensoh S.,2
validated by Trenson S.,6
validated by Trybou M.,6
validated by Tyteca H.,9
validated by Tyteca T.,4
validated by Tytgat B.,11
validated by Téchy K.,1
validated by Tück M.,361
validated by Uitterhaegen B.,18
validated by Ureel U.,1
validated by Uyttenbroeck R.,452
validated by V G      Danny,10
validated by VAN LITH J,1
validated by VAN NUVEL,1
validated by VAN SCHEPD,3
validated by VANDERZA G,315
validated by VERHOEFF P,4
validated by VERLEYSE L,478
validated by VERLIND LC,110
validated by VERSTRAE C,7
validated by VRAY S,3290
validated by Vaes E.,1
validated by Vaes L.,7
validated by Valdueza M.,40
validated by Van Acker K.,6
validated by Van Acker R.,1
validated by Van Acker T.,1
validated by Van Aken M.,1
validated by Van Alboom      W.,16
validated by Van Alboom W.,29
validated by Van Assche      J.,1
validated by Van Assche      S.,13
validated by Van Assche J.,26
validated by Van Assche L.,7
validated by Van Assche S.,87
validated by Van Assche W.,20
validated by Van Asten      K.,11
validated by Van Asten K.,63
validated by Van Ballaert      S.,1
validated by Van Ballaert S.,3
validated by Van Bastelaere S.,1
validated by Van Belleghem      J,3
validated by Van Belleghem J.,54
validated by Van Bever C.,1
validated by Van Bever K.,1
validated by Van Braeckel J.,1
validated by Van Breedam K.,2
validated by Van Brussel D.,6
validated by Van Bueren T.,1
validated by Van Bunder L.,5
validated by Van Camp B.,6
validated by Van Campenhout M.,5
validated by Van Cann J.,1
validated by Van Cauwenberge S.,1
validated by Van Cleuvenbergen,8
validated by Van Cleuvenbergen R.,39
validated by Van Cleynenbreugel,4
validated by Van Cleynenbreugel S,13
validated by Van Daele H.,1
validated by Van Daele J.,1
validated by Van Damme      K.,12
validated by Van Damme G.,1
validated by Van Damme K.,4
validated by Van Decraen K.,3
validated by Van Den Broeck     C,1
validated by Van Den Broeck C.,9
validated by Van Der Krieken,1
validated by Van Der Krieken B.,23
validated by Van Dingenen      R.,2
validated by Van Dingenen R.,11
validated by Van Dongen K.,2
validated by Van Doninck N.,4
validated by Van Doorslaer      H,1
validated by Van Doorslaer H.,11
validated by Van Dorpe V.,28
validated by Van Dorsselaer,3
validated by Van Dorsselaer P.,52
validated by Van Driessche L.,1
validated by Van Dyck      V.,16
validated by Van Dyck B.,7
validated by Van Dyck E.,12
validated by Van Dyck V.,167
validated by Van Echelpoel W.,2
validated by Van Eenaeme      D.,10
validated by Van Eenaeme D.,215
validated by Van Elst T.,1
validated by Van Gasse      W.,2
validated by Van Gasse W.,8
validated by Van Gestel      P.,1
validated by Van Gestel P.,2
validated by Van Gils W.,1
validated by Van Ginderdeuren K.,1
validated by Van Ginhoven W.,1
validated by Van Gompel      W.,1
validated by Van Gompel L.,1
validated by Van Gompel W.,14
validated by Van Gorp P.,3
validated by Van Grimberge A.,3
validated by Van Havermaet F.,2
validated by Van Heddegem W.,12
validated by Van Hees S.,1
validated by Van Heghe      G.,6
validated by Van Heghe G.,73
validated by Van Heghe R.,19
validated by Van Heghe V.,1
validated by Van Hemelryck R.,8
validated by Van Herrewege A.,1
validated by Van Hertum G.,18
validated by Van Hoof W.,1
validated by Van Hoorebeke E.,2
validated by Van Hoorick      G.,9
validated by Van Hoorick G.,94
validated by Van Hoovels      G.,16
validated by Van Hoovels G.,341
validated by Van Hooyconck N.,1
validated by Van Hooydonck      N,2
validated by Van Houdenhove R.,2
validated by Van Hout F.,1
validated by Van Hove G.,8
validated by Van Hove M.,1
validated by Van Hove W.,6
validated by Van Hoydonck B.,1
validated by Van Ingelgem S.,46
validated by Van Keer      K.,1
validated by Van Keer K.,18
validated by Van Kerckhoven,93
validated by Van Kerckhoven J.,259
validated by Van Laer L.,3
validated by Van Landuyt G.,3
validated by Van Landuyt W.,2
validated by Van Langenhove A.,2
validated by Van Loco N.,10
validated by Van Lommel V.,12
validated by Van Loo      T.,1
validated by Van Loo T.,66
validated by Van Loock L.,5
validated by Van Looveren      S.,1
validated by Van Looveren S.,1
validated by Van Loy H.,3
validated by Van Lyssebetten Y.,1
validated by Van Malderen M.,1
validated by Van Marck      E.,1
validated by Van Marck E.,3
validated by Van Meel      C.,11
validated by Van Meel C.,250
validated by Van Meensel M.,1
validated by Van Middelkoop R.,3
validated by Van Mol B.,1
validated by Van Moorleghem C.,1
validated by Van Mulders      M.,1
validated by Van Mulders D.,2
validated by Van Mulders M.-J.,2
validated by Van Nieuwenhuyse J.,1
validated by Van Nieuwenhuyze A.,1
validated by Van Nuffel      P.,10
validated by Van Nuffel P.,12
validated by Van Oost      F.,2
validated by Van Oosterwyck R.,2
validated by Van Opstal      M.,2
validated by Van Opstal M.,5
validated by Van Passel      Brig,1
validated by Van Passel      F.,2
validated by Van Passel B.,16
validated by Van Passel F.,28
validated by Van Poelgeest G.,1
validated by Van Renterghem E.,1
validated by Van Rompaey      K.,2
validated by Van Rompaey K.,5
validated by Van Roy A.,11
validated by Van Sanden      P.,3
validated by Van Sanden J.,1
validated by Van Sanden P.,106
validated by Van Schandevyl D.,11
validated by Van Scharen K.,1
validated by Van Sebroeck B.,17
validated by Van Seggelen C.,1
validated by Van Soolingen J.,1
validated by Van Steenkiste,1
validated by Van Steenkiste R.,10
validated by Van Steenweghen B.,1
validated by Van Steenwinkel,4
validated by Van Steenwinkel C.,121
validated by Van Stichel N.,1
validated by Van Stipdonk A.,60
validated by Van Thienen G.,2
validated by Van Thuyne B.,5
validated by Van Tongelen P.,4
validated by Van Tricht      K.,3
validated by Van Tricht K.,5
validated by Van Tulder      D.,16
validated by Van Tulder D.,90
validated by Van Uytvanck      J.,7
validated by Van Uytvanck J.,22
validated by Van Vlierden      G.,1
validated by Van Vlierden G.,7
validated by Van Vooren P.,8
validated by Van Wichelen      J.,3
validated by Van Wichelen  J.,24
validated by Van Wichelen J.,57
validated by Van Winkel J.,119
validated by Van Wolputte M./Garc,1
validated by Van Zweden J.,4
validated by Van de Casteele,89
validated by Van de Casteele D.,267
validated by Van de Kerckhove P.,1
validated by Van de Laer     H.,1
validated by Van de Laer H.,6
validated by Van de Meutter F.,3
validated by Van de Poel     S.,3
validated by Van de Poel  S.,3
validated by Van de Poel S.,14
validated by Van de Populiere,4
validated by Van de Populiere D.,19
validated by Van de Schoot     E.,1
validated by Van de Schoot E.,40
validated by Van de Velde P.,11
validated by Van de Ven J.,2
validated by Van de Venne T.,4
validated by Van de Voorde J.,1
validated by Van de velde L.,1
validated by Van den Abbeele L.,1
validated by Van den Berghe J.,38
validated by Van den Berghe L.,1
validated by Van den Bossche,2
validated by Van den Bossche F.,4
validated by Van den Bossche W.,1
validated by Van den Broeck J.,18
validated by Van den Broeck T.,5
validated by Van den Bussche,7
validated by Van den Bussche J.,22
validated by Van den Bussche S.,69
validated by Van den Eynde I.,1
validated by Van den Heuvel     D,1
validated by Van den Heuvel     G,3
validated by Van den Heuvel D.,73
validated by Van den Heuvel G.,72
validated by Van den Neucker,2
validated by Van den Neucker T.,43
validated by Van den Wyngaert,108
validated by Van den Wyngaert F.,8
validated by Van den Wyngaert G.,810
validated by Van der Auwera     S,2
validated by Van der Auwera I.,2
validated by Van der Auwera S.,3
validated by Van der Beken D.,14
validated by Van der Donckt     J,2
validated by Van der Donckt J-F.,10
validated by Van der Donckt J.-F.,8
validated by Van der Schans J.,8
validated by Van der Slikke R.,2
validated by Van der Spek E.,91
validated by Van der Steen K.,90
validated by Van der Veken B.,14
validated by Van der Veken G.,1
validated by Van der Veken S.,4
validated by Van der Ven F.,1
validated by Vanaelst E.,1
validated by Vanautgaerden G.,8
validated by Vanaverbeke J.,11
validated by Vanberghe K.,131
validated by Vanbiervliet A.,1
validated by Vancauwenberghe B.,7
validated by Vancayzeele L.,1
validated by Vanclooster N.,1
validated by Vandamme I.,1
validated by Vande Meulebroeke R.,4
validated by Vande Moortel L.,1
validated by Vande Sompele W.,1
validated by Vandeberg E.,3
validated by Vandebergh J.,1
validated by Vandecruys L.,8
validated by Vandekeybus F.,1
validated by Vandekeybus S.,1
validated by Vandemaele W.,1962
validated by Vanden Abeele      L,7
validated by Vanden Abeele L.,67
validated by Vanden Begin G.,2
validated by Vanden Berghe R.,1
validated by Vanden Borre J.,2
validated by Vanden Bossche M.,4
validated by Vanden Broeck G.,1
validated by Vandenbergh L.,52
validated by Vandenberghe K.,132
validated by Vandenberghe M.,4
validated by Vandenberghe T.,10
validated by Vandendriessche B.,1
validated by Vandendriessche G.,2
validated by Vandenhoudt R.,146
validated by Vandenplas N.,1
validated by Vandeperre M.,3
validated by Vandepitte S.,8
validated by Vandeplas J.,14
validated by Vandeput J.,29
validated by Vandeput L.,2
validated by Vandeput M.,2
validated by Vander Linden      S,3
validated by Vander Linden S.,12
validated by Vanderbeke L.,3
validated by Vanderhaeghe J.,27
validated by Vanderhallen M.,1
validated by Vanderhoydonc J.P.,1
validated by Vandermeulen J.,8
validated by Vanderoye L.,1
validated by Vanderschueren B.,7
validated by Vandersmissen P.,16
validated by Vandersteen G.,1
validated by Vanderstukken M.,6
validated by Vandevenne S.,2
validated by Vandevoorde H.,15
validated by Vandevyvre X.,8
validated by Vandewaerde H.,2
validated by Vandewalle H.,1
validated by Vandewiele T.,1
validated by Vandromme J.,1
validated by Vanermen L.,29
validated by Vangansbeke M.,1
validated by Vangeel R.,3
validated by Vangenechten E.,1
validated by Vangerven P.,9
validated by Vangheluwe J.,2
validated by Vanhamme M.,10
validated by Vanhauwere P.,1
validated by Vanherck (hugo) S.,1
validated by Vanherck H.,3
validated by Vanherpe Y.,8
validated by Vanhoutte J.,36
validated by Vanhulle G.,9
validated by Vanhulle H.,1527
validated by Vanhulle R.,2
validated by Vanhullebusch R.,1
validated by Vankerkhoven F.,2
validated by Vankerkhoven M.,16
validated by Vanloot G.,5
validated by Vanmeerbeeck P.,287
validated by Vanmoerkerke M.,5
validated by Vannieuwenhuyse B.,16
validated by Vannotten W.,31
validated by Vanoost M.,2
validated by Vanoosterhout G.,2
validated by Vanormelingen P.,8060
validated by Vanpaemel L.,10
validated by Vanreusel W.,23
validated by Vanseuningen I.,1
validated by Vanseveren M-P.,1
validated by Vansteenbrugge H.,26
validated by Vansteenvoort D.,1
validated by Vantieghem P.,47
validated by Vantieghem S.,96
validated by Vanvaerenbergh  F.,6
validated by Vanvaerenbergh F.,7
validated by Vanweehaeghe M.-J.,2
validated by Vanwesenbeeck W.,9
validated by Vanwezer F.,1
validated by Vanwijnsberghe A.,26
validated by Vanwijnsberghe D.,4
validated by Vassen F.,23
validated by Velghe S.,49
validated by Ven A.,2
validated by Ven der Spek E.,1
validated by Veraghtert W.,151
validated by Verbeek G.,6
validated by Verbeelen D.,8
validated by Verbeke M.,1
validated by Verbeure W.,1
validated by Verbeylen G.,2
validated by Verbist M.,2
validated by Verboomen R.,4
validated by Verboven H.,4
validated by Verbruggen C.,53
validated by Verbruggen S.,8
validated by Vercayie D.,3
validated by Vercruysse W.,134
validated by Verdonck R.,3
validated by Vereecken N.,4
validated by Vereyken B.,1
validated by Verfaillie E.,4
validated by Vergara A.,3
validated by Vergauwen G.,4
validated by Vergote G. / Noppe S,2
validated by Verhaeghe F.,2
validated by Verhaeghe K.,1
validated by Verhaeghe S.,2
validated by Verhaeghe W.,1
validated by Verhaest E.,2
validated by Verheirstraeten M.,4
validated by Verhelst K.,2
validated by Verhelst L.,422
validated by Verheyde F.,800
validated by Verheyden W.,36
validated by Verheyen S.,55
validated by Verhofstadt H.,2
validated by Verleye M.,20
validated by Verleysen F.,1
validated by Vermeer F.,9
validated by Vermeersch X.,3
validated by Vermeire G.,3
validated by Vermeiren H.,15
validated by Vermeren H.,1
validated by Vermetten W.,44
validated by Vermeulen P.,3
validated by Vermeulen T.,122
validated by Vermeyen E.,1
validated by Vermeylen W.,1
validated by Vermoortele M.,1
validated by Vermylen R.,107
validated by Vernieuwe R.,9
validated by Verplaetse J.,1
validated by Verroken E.,109
validated by Verroken J.,6
validated by Verroken L.,1
validated by Verschelden H.,2
validated by Verschoore K.,2
validated by Verschraege J.,2
validated by Verschraegen T.,2
validated by Verschraegen W.,119
validated by Verschueren T.,117
validated by Verselder B.,1
validated by Versigghel J.,176
validated by Verstichel P.,15
validated by Verstraete A.,3
validated by Verstraete B.,11
validated by Verstraete Y.,7
validated by Verstraeten A.,2
validated by Verstraeten D.,155
validated by Verstraeten J.,20
validated by Verstraeten L.,14
validated by VerstraetenL.,1
validated by Vertommen C.,9
validated by Vertommen W.,64
validated by Vervaeke D.,1
validated by Vervaet N.,1
validated by Vervaet P.,6
validated by Vervecken P.,143
validated by Vervloet P.,12
validated by Vervloet V.,1
validated by Vervueren A.,3
validated by Vervynck E.,4
validated by Verwaerde J.,1
validated by Verwimp J.,16
validated by Verzele J.,1
validated by Vetters A.,9
validated by Veys W.,3
validated by Vicenzi H.,2
validated by Vieren B.,1
validated by Vincken A.,2
validated by Vindevoghel J.,929
validated by Virginie U.,2
validated by Vissers T.,1
validated by Vlaeminck P.,26
validated by Vlaeymynck J.,1
validated by Vliegenthart A.,1
validated by Vlinderwerkgroep Tax,28
validated by Vochten T.,138
validated by Vogelwerkgroep Fruit,2
validated by Vogelwerkgroep Oost-,1
validated by Vogelwerkgroep Zuid-,1
validated by Voituron D.,1
validated by Volckaert D.,69
validated by Volont I.,17
validated by Von Werne D.,2
validated by Vorsselmans F.,2
validated by Vos K.,1
validated by Vos S.,3
validated by Vrancken C.,18
validated by Vray S.,21
validated by WAHIS R,1
validated by WARLET HM,42
validated by WARNCKE K,638
validated by WIERING H,23
validated by Waegemans W.,1
validated by Waelkens K.,1
validated by Wagemans F.,2
validated by Walgraffe G.,34
validated by Wallays H.,2918
validated by Walma H.,1
validated by Walraven W.,1
validated by Walravens E.,61
validated by Walravens M.,16
validated by Walsdorff T.,2
validated by Warreyn G.,2
validated by Waterloo L.,1
validated by Waterschoot B.,6
validated by Wauters M.,6
validated by Wayenburg S.,2
validated by Weckhuysen W.,6
validated by Weemaes K.,14
validated by Weetjens E.,50
validated by Weijters A.,4
validated by Wellens K.,1
validated by Wellens T.,1
validated by Wellens W.,14
validated by Werts J.,16
validated by Wesselingh R.,1
validated by Weyts K.,1
validated by Wieme G.,6
validated by Wieërs N.,1
validated by Wijnsouw P.,19
validated by Wilfried M.,3
validated by Willaert B.,9
validated by Willaert M.,1
validated by Wille E.,7
validated by Willekens M.,65
validated by Willems J.,1
validated by Willems L.,11
validated by Willems M.,76
validated by Willems W.,14
validated by Willemsens S.,1
validated by Willemyns D.,4
validated by Willis C.,1
validated by Wils B.,1
validated by Wilssens V.,1
validated by Wim Debruyne,1
validated by Wim Dewilde,1
validated by Wim Vermeyen,1
validated by Winant P.,5
validated by Windels M.,6
validated by Windey R.,111
validated by Windmolders K.,138
validated by Wintein C.,8
validated by Winters L.,52
validated by Winters R.,1
validated by Wislez J-M.,1
validated by Witters J.,1
validated by Wouters G.,1
validated by Wouters H.,13
validated by Wouters K.,1
validated by Wouters T.,2
validated by Wuelche J.,8
validated by Wuine P.,11
validated by Wuyts F.,1
validated by Wuyts K.,9
validated by Wuyts R.,4
validated by Wybouw J.,5
validated by Wyckaert P.,1
validated by Wyers K.,4
validated by Wynants G.,32
validated by Wynants R.,14
validated by Wyns E.,3
validated by Wyns F.,39
validated by Wysmantel N.,11
validated by Yildirim A.,3
validated by Ysebaert M.,1
validated by Yves G.,208
validated by Zanté C.,7
validated by Zels K.,2
validated by Zurings B.,112
validated by Zvar E.,2
validated by Zvar E./ Gerits M.,1
validated by Zvar E./Gerits M.,1
validated by Zwaaneveld J.,8
validated by Zwaenepoel A.,266
validated by [OV] Laurent VdB,3
validated by autre,3
validated by bl. dine,19
validated by blankaart kasteel,1
validated by c labeye,1
validated by cebe mob,3
validated by claes H.,49
validated by claeys I.,4
validated by costrop D.,4
validated by d'Hooge W.,1
validated by d'Hoop S.,24
validated by de Beenhouwer      M,1
validated by de Clerck      J.,3
validated by de Gottal P.,1
validated by de Koning H.,12
validated by de Thier T.,5
validated by de koster,1
validated by de slobkousjes,1
validated by den Hartog-Noordam D,1
validated by dine bl.,4
validated by dr PlAntoon,22
validated by fotoopa,59
validated by frachon,1
validated by francis heylen,1
validated by geert elskens,1
validated by herman dhondt,9
validated by jnm gent,4
validated by karel gh,436
validated by karen vh,1
validated by katleen m,9
validated by lanners Y.,2
validated by lesaccount Artevelde,33
validated by marianne en mauro,5
validated by mg lefebvre,1
validated by niverolle et mouquet,1
validated by paul & krista,960
validated by paula smits,5
validated by rasmont p,1
validated by sancho (hugo) vanher,3
validated by sp,583
validated by steven goossens,1
validated by van Aalst J.,1
validated by van Driessche      L,1
validated by van Poelgeest      G,1
validated by van Sebroeck      B.,8
validated by van Sebroeck B.,9
validated by van Stipdonk      A.,9
validated by van Stipdonk A.,5
validated by van Winkel      J.,1
validated by van de Vijver     Y.,1
validated by van den Bosch     M.,1
validated by van der Spek     E.,46
validated by vandeberg E.,1
validated by victor max,1
validated by werner v,3
validated by wilde bijenwerkgroep,80
validated on the basis of a document,2440
validated on the basis of likelihood,36104
validated without a document in support (expertise or additional informations),110447
verificó Shreve,1
verified,748793
verified by specialist,7015
已鑑定,158
