identificationVerificationStatus,reps
validated by Flasse J.,12
validated by Flasse M.,5
validated by Fleurbaaij P.,6
validated by Fleurbaey F.,9
validated by Flipkens G.,2
validated by Flipkens K.,2
validated by Floré P.,17
validated by Flour  J.M.E.,1
validated by Fockaert L.,8
validated by Fockenier C.,2
validated by Fockenier Christophe,1
validated by Folschweiller M,526
validated by Fondry des chiens 10,2
validated by Foquet R.,113
validated by Foquet R. en B.,20
validated by Foquet R./Foquet B.,988
validated by Formation INeE - Pro,1
validated by Fossion M.,1
validated by Foubert O.,87
validated by Fourez P.,2
validated by Fourez S.,1
validated by Fourie W.,6
validated by Fourneau J.,1
validated by Frachon,73
validated by Fraeyman E.,1
validated by Francoise D.,3
validated by Franken T.,2
validated by François G.,4
validated by Frederik De Vos,1
validated by Freisen P.,45
validated by Frennet P.,17
validated by Frere M.,13
validated by Fruyt C.,3
validated by Fuchs O.,2
validated by Funcken P.,2
validated by GASPAR C,2
validated by GAUTHIER J,363
validated by GODEAU JF,198
validated by GRYFFROY D,5
validated by Gabrys F.,78
validated by Gailly D.,1
validated by Gailly P.,1
validated by Gailly R.,25
validated by Galens D.,7
validated by Garin M.,35
validated by Garré L.,1
validated by Gasthuys L.,51
validated by Gauquie B.,27
validated by Gautier V.,2
validated by Geboers M.,22
validated by Geboes A-L.,6
validated by Geelhand B.,2
validated by Geenen D.,8
validated by Geens J.,2
validated by Geens M.,3
validated by Geeraerts G.,4
validated by Geeraerts K.,554
validated by Geerts C.,55
validated by Geerts F.,8
validated by Geerts P.,10
validated by Gelbgras F.,27
validated by Gellens N.,35
validated by Gellycnk S.,7
validated by Gellynck S.,11
validated by Gentjens R.,2
validated by George M.,2
validated by Gerards C.,1
validated by GestionEaudYves,11
validated by Geudens R.,187
validated by Geuens T.,7
validated by Geukens K.,2
validated by Ghyselen C.,5
validated by Gielen K.,21
validated by Gielen S.,6
validated by Giglot J.,1
validated by Gijs A.,2
validated by Gillard M.,7
validated by Gillet J-C.,1
validated by Gillet J.-C.,1
validated by Gillis H.,1
validated by Gilon S.,2
validated by Gimdal R.,1
validated by Gindt F.,4
validated by Gintelenberg K.,1
validated by Gios M.,4
validated by Glaes J.,1
validated by Glibert J.,152
validated by Gobert S.,34
validated by Godding E.,110
validated by Goderis K.,4
validated by Godfried W.,8
validated by Godfroid W.,3
validated by Goemaere K.,1
validated by Goemaere W.,1
validated by Goens E.,1
validated by Goes J.,1
validated by Goetelen D.,1
validated by Goethals H.,3
validated by Goethals M.,1
validated by Goethals S.,1
validated by Goethals V.,20
validated by Goossens R.,1
validated by Goossens S.,11
validated by Goovaerts A.,8
validated by Goris S.,2
validated by Gorrens M.,269
validated by Gosselin M.,12
validated by Gosseye J.,1
validated by Goubout-Guillemyn M.,1
validated by Goudeseune  J.,1
validated by Goudeseune B.,2
validated by Goudman T.,4
validated by Govaert S.,23
validated by Govaerts G.,17
validated by Gramberg M.,5
validated by Grandsart C.,1
validated by Graulus J.,1
validated by Gris J.,1
validated by Groenez G.,17
validated by Grolus K.,3
validated by Grootaers G.,4
validated by Gruwier C.,30
validated by Gruwier Christophe,1
validated by Guelinckx R.,8
validated by Guerard A.,134
validated by Guido S,2
validated by Guyon J.,8
validated by Guében P.,1
validated by Guégan M-C.,4
validated by Guégan M.-C.,4
validated by Gys R.,2
validated by Gysbertsen R.,7
validated by Gyselinck T.,25
validated by Gélon M.,20
validated by Gérard M.,136
validated by HLUSEK J,145
validated by Haelewyn R.,1
validated by Hagelandse Heuvelstr,67
validated by Halet E.,33
validated by Halleux M.,1
validated by Hamelinck W.,4
validated by Hammond M,1
validated by Hammond M.,7
validated by Hannay A.,4
"validated by Hannay, Albert",1
validated by Hannen J.,2
validated by Hanoulle S.,3
validated by Hans W,3
validated by Hansen K.,101
validated by Hanssens B.,183
validated by Hantson E.,4
validated by Hantson S.,5
validated by Happaerts F.,1
validated by Hardy J-C.,8
validated by Hardy J.-C.,3
validated by Haustraete T.,3
validated by Hautekiet W.,36
validated by Hela F.,58
validated by Hellebaut P.,1
validated by Hellebuyck E.,1
validated by Hellemans S.,1
validated by Helpers J.,27
validated by Helsen K.,4
validated by Helsen L.,1
validated by Helsen P.,12
validated by Hemans R.,1
validated by Henderieckx C.,1
validated by Hendrickx M.,1
validated by Hendrickx P.,1048
validated by Hendrickx R.,297
validated by Hendriks J.,1
validated by Hendrix J.,10
validated by Hendrix R.,30
validated by Hennebel D. en W.,16
validated by Hennebel D./Hennebel,20
validated by Henneresse T.,8
validated by Henri T.,11
validated by Henry M.,12
validated by Hens A.,2
validated by Herbosch F.,3
validated by Hereman N.,2
validated by Heremans R.,58
validated by Heriman S.,1
validated by Herman G.,4
validated by Hermans D.,5
validated by Hermans F.,5
validated by Hermans S.,101
validated by Hermans T./Hermans K,1
validated by Herr C.,5
validated by Herreman S.,1
validated by Herreman Shani,1
validated by Herremans M.,291
validated by Hervé Paques,1
validated by Herwig Mees,9
validated by Heyman H.,1
validated by Heyman J.,1
validated by Heyman T.,1
validated by Heyman V.,25
validated by Hidvegi F.,2
validated by Hiemstra D.,2
validated by Hiemstra R.,25
validated by Hilde Vandevoorde,2
validated by Hillewaert H.,15
validated by Hoeymans B.,77
validated by Hofman M.,1
validated by Hofman P.,2
validated by Hollander F.,1
validated by Hoogendam M.,2
validated by Hoozee J.,4
validated by Hoppenbrouwers M.,1
validated by Hordies F.,1
validated by Horemans S.,85
validated by Hoste S.,2
validated by Hotting M.,1
validated by Houben S.,3
validated by Houbrigts S.,1
validated by Houkes J.,2
validated by Houthoofd K.,3
validated by Huart N.,3
validated by Hugo Bender,5
validated by Hugo Van Doorslaer,1
validated by Hugo Wouters,2
validated by Hugé J.,6
validated by Hurkmans N.,5
validated by Hustinx K.,2
validated by Huybrechts R.,10
validated by Huygelen G.,2
validated by Huygens P.,4
validated by Huygens W.,1
validated by Huyghe P.,1
validated by Huysmans T.,4
validated by Hylebos D.,8
validated by I. Robbe,20
validated by ISERBYT S,28
validated by Ide J.,11
validated by Ingelbrecht L.,9
validated by Ingels A.,1
validated by Inventarisatie Damme,6
validated by Isis V.,1
validated by J-E. Dhynes,1
validated by J. Paes,1
validated by J.T. Smit,1
validated by JANSSENS K,634
validated by JK Leroy,1
validated by JNM 's Heerenbosch,3
validated by JNM Afdeling Akerlan,1
validated by JNM Brugge,12
validated by JNM Durmeland,8
validated by JNM Eeklo,1
validated by JNM Fruitstreek,21
validated by JNM Gent,11
validated by JNM Hageland-Zuiderk,3
validated by JNM Klein-Brabant,7
validated by JNM Land van Aalst,6
validated by JNM Leievallei,3
validated by JNM NWB,3
validated by JNM Noordwest-Braban,1
validated by JNM Pallieterland,2
validated by JNM Poekebeek,16
validated by JNM Roeselare,13
validated by JNM Taxandria,22
validated by JNM Waasland,3
validated by JNM Westland,15
validated by JNM Zottegem,2
validated by JNM Zuidwest-Brabant,1
validated by JORIS I,1006
validated by Jacob P.,3
validated by Jacobs A.,78
validated by Jacobs G.,2
validated by Jacobs H.,4
validated by Jacobs I.,18
validated by Jacobs L.,10
validated by Jacobs M.,30
validated by Jacobs S.,3
validated by Jacquemin A.,1
validated by Jacquet A.,6
validated by Jacquet P.,4
validated by Jan Ryde,1
validated by Jan Verroken,3
validated by Jannis G.,5
validated by Janousek D.,3
validated by Jans A.,1
validated by Jansen J.,15
validated by Jansen L.,35
validated by Jansen T.,7
validated by Janssen J.,1
validated by Janssen L.,751
validated by Janssen M.,1
validated by Janssen T.,1
validated by Janssens F.,65
validated by Janssens G.,7
validated by Janssens K,884
validated by Janssens M.,11
validated by Janssens N.,2
validated by Janssens S.,1
validated by Janssens W.,2
validated by Jean D.,3
validated by Jean-Marie Lommaert,1
validated by Jeanty N.,8
validated by Jenard P.,40
validated by Jnm Limburg,5
validated by Jnm Neteland,2
validated by Joannes Vindevoghel,1
validated by Johan R,51
validated by Johan VG,2
validated by Joissains E.,1
validated by Joly V.,1
validated by Jonckers M.,4
validated by Jonckers P.,1
validated by Jonckheere D.,5
validated by Jonckheere G.,1
validated by Jonckheere K.,12
validated by Joppe Hermans,1
validated by Joris J.,1
validated by Joris W,1
validated by Jossa L.,62
validated by Josten D.,7
validated by Jourquin J.,1
validated by KLaessens D.,3
validated by Kaerts K.,1
validated by Kalkman V.,1
validated by Kampen A.,1
validated by Karin Gielen,1
validated by Keirsebilck P.,1
validated by Kempeners D.,17
validated by Kenens J.,36
validated by Kennis P.,3
validated by Kerkhofs J.,13
validated by Kerstens J.,10
validated by Kesteloot M.,1
validated by Kestemont B.,1
validated by Kestemont L.,13
validated by Keteleer S.,75
validated by Keuppens M.,40
validated by Kever D.,1
validated by Kiebooms J.,2
validated by Kimberley T.,1
validated by Kindermans B.,2
validated by Klaas A.,1
validated by Klaessens D.,3
validated by Kleijnen G.,5
validated by Klein W.,1
validated by Knaepen W.,13
validated by Kneepkens C.,1
validated by Koel H.,4
validated by Koen,200
validated by Konings F.,1
validated by Krijnen P.,1
validated by Kristien Weyts,1
validated by Kristine & Christoph,1
validated by Kuhlmann M,25
validated by Kuijken G.,1
validated by Kuipers C.,17
validated by Kusters F.,1
validated by Kuyken R.,4
validated by Kühnen J.,1
validated by L'Homme B.,2
validated by L'amiral E.,1
validated by LECLERCQ J,20049
validated by LEFEBER V,6897
validated by LIONGO E,554
validated by LUYTS C,2
validated by Labeye C.,1
validated by Lacoere L.,1
validated by Laeremans J.,1
validated by Laermans W.,3
validated by Laes J.,1
validated by Lagasse - Gugala B.,3
validated by Lagasse C.,2
validated by Lagasse-Gugala B.,2
validated by Laget D.,12
validated by Lakiere G.,1
validated by Lakiere P.,1
validated by Lambeets K.,104
validated by Lambert F.,18
validated by Lambrechts I.,3
validated by Lambrechts J.,180
validated by Lambrechts T.,2
validated by Lammens P.,9
validated by Lammers M.,4
validated by Lamont M.,5
validated by Lams L.,32
validated by Lange T.,4
validated by Lanners Y.,10
validated by Laps D.,10
validated by Larivière B.,17
validated by Launoy J.,2
validated by Laureys B.,1
validated by Laurian VM,4
validated by Laurijssens G.,9
validated by Lauwers E.,6
validated by Lavens K.,1
validated by Lavreys E.,7
validated by Lavrysen E.,1
validated by Le Comte      M.,1
validated by Le Roy V.,7
validated by Leclercq J,1
validated by Leclercq J.,2407
validated by Lecocq T,157
validated by Ledegen H.,10
validated by Leduc L.,6
validated by Leemans K.,4
validated by Leemans R.,2
validated by Leestmans S.,51
validated by Lefeber L.,8
validated by Lefebvre F.,10
validated by Lefevre T.,2
validated by Lefranc M.,16
validated by Legrain B.,3
validated by Lehane X.,1
validated by Lehouck M.,1
validated by Leirens V.,3
validated by Lejeune S.,4
validated by Lejon V.,1
validated by Lelièvre G.,1
validated by Leloup F.,7
validated by Lemahieu I.,1
validated by Lemaire M. / Lorin E,38
validated by Lemaire M./Lorin E.,44
validated by Lemmens H.,11
validated by Lemmens M.,2
validated by Lemmens P.,1
validated by Lemmers P.,1
validated by Lemouche A.,3
validated by Lenaers C.,1
validated by Lenaerts B.,1
validated by Lenaerts E.,1
validated by Lens B.,4
validated by Leo Janssen,1
validated by Leo Vaes,1
validated by Lepoutre L.,1
validated by Lepre K.,1
validated by Leroy J-K.,2
validated by Lesaccount UA F&F2,3
validated by Lesage K.,1
validated by Lestrate E.,8
validated by Leurelle J.,8
validated by Leveque J.,25
validated by Lewylle I.,1
validated by Leynen N.,1
validated by Leys J.,3
validated by Leys S.,1
validated by Leysen K.,26
validated by Libeer R.,10
validated by Librecht R.,1
validated by Lieben G.,2
validated by Liefhooghe G.,1
validated by Liegeois G.,5
validated by Liessens S.,4
validated by Lietaer T.,2
validated by Lighezzolo P.,4
validated by Lippens S.,5
validated by Lisfranc M.,1
validated by Lock K.,10
validated by Lode Gilis,1
validated by Lombart A.,7
validated by Lommelen E.,5
validated by Lommée B.,6
validated by Loneux P.,1
validated by Loobuyck H.,5
validated by Lookman R.,8
validated by Loones M.,1
validated by Loos G.,613
validated by Loos L.,3
validated by Los K.,1
validated by Lossy K.,25
validated by Lot L.,29
validated by Luc De Cock,1
validated by Luc Vanden Abeele,1
validated by Luijten F.,14
validated by Lust F.,2
validated by Lutin-Smet B.,68
validated by Luyten N.,5
validated by Luyts G.,14
validated by Lybeer T.,1
validated by Lycops J.,16
validated by MAGIS N,1
validated by MARSHALL L,163
validated by MATHOT P,2960
validated by MCaekebeke L.,2
validated by MICHEZ D,500
validated by Maarten Jacobs,2
validated by Macharis M.,4
validated by Machielsen W.,30
validated by Mackels T.,3
validated by Macquoy E.,5
validated by Maebe K,212
validated by Maenen J.,10
validated by Maertens K.,1
validated by Maes D.,29
validated by Maes E.,3
validated by Maes F.,5
validated by Maes J.,21
validated by Maes K.,74
validated by Maes L.,19
validated by Maes T.,1
validated by Mahaux Y.,1
validated by Maho I.,1
validated by Mairesse J-L.,2
validated by Mairy F.,1
validated by Malfait E.,2
validated by Maly S.,2
validated by Mangelschots M.,19
validated by Mannaert P.,2
validated by Many H.,1
validated by Marc Lamont,1
validated by Marchi A.,1
validated by Marcus,2
validated by Mardulyn H.,16
validated by Mariage T.,26
validated by Marieke en Dolf,2
validated by Marien V.,1
validated by Marijns H.,1
validated by Mariën M.,2
validated by Marlière F.,1
validated by Martens D.,9
validated by Martens F.,26
validated by Martens M.,93
validated by Martens T.,1
validated by Martens W.,13
validated by Martin A.,1
validated by Martin D.,1
validated by Martin T.,1
validated by Martin Y.,11
validated by Massy P.,2
validated by Matagne M.,16
validated by Mathelart C.,31
validated by Mathieu G.,1
validated by Matte L.,1
validated by Matthys P.,9
validated by Matthys R.,2
validated by Matthyssen E.,20
validated by Max V.,1
validated by Mechthold O.,14
validated by Meekel J.,2
validated by Meekers T.,2
validated by Meerschaut E.,11
validated by Meert P.,2
validated by Meert R.,39
validated by Mees B.,2
validated by Mees H.,27
validated by Mees J.,63
validated by Mees P.,2
validated by Meeus D.,1
validated by Meeuwis R.,2
validated by Meijrink M.H.F.,1
validated by Meininger P.,7
validated by Meire J.,1
validated by Melis M.,5
validated by Mellaerts L.,14
validated by Mellaerts N.,1
validated by Menschaert L.,7
validated by Menten J.,107
validated by Menten K.,2
validated by Menu J-F.,2
validated by Menu J.-F.,2
validated by Menu S.,1
validated by Merckx T.,2
validated by Mergaerts M.,111
validated by Mergeay J.,4
validated by Merken R.,2
validated by Mersch R.,1
validated by Mertens J.,2
validated by Mertens S.,2
validated by Mertens W.,38
validated by Mestdagh B.,45
validated by Mestdagh C.,16
validated by Meulemans J.,2
validated by Meylaerts J.,3
validated by Meynen E.,17
validated by Meysman M-L.,1
validated by Michalowski J-M.,6
validated by Michalowski J.M.,8
validated by Michaux D.,2
validated by Michel P.,1
validated by Michez D.,32
validated by Michiels D.,3
validated by Migchelbrink A-J.,1
validated by Minnebo D.,5
validated by Mireille H.,4
validated by Misonne M-C. et J-F.,1
validated by Mob C.,1
validated by Moens J.,1
validated by Moerkerke M.,1
validated by Moerman R.,2
validated by Moers A.,22
validated by Moesen M.,3
validated by Molenaar E.,14
validated by Molinard A.,1
validated by Mollet J.,19
validated by Moncousin M.,1
validated by Moniotte P.,2
validated by Monteyne K.,1
validated by Moonen D.,1
validated by Moonen E.,88
validated by Moons B.,12
validated by Moons D.,1
validated by Moons P.,7
validated by Moorkens T.,1
validated by Moors P.L.,1
validated by Moquet L.,7
validated by Moreau K.,6
validated by Morez K.,2
validated by Moris G.,2
validated by Morren J.,1
validated by Mortelmans J.,71
validated by Mortier B.,2
validated by Mostien Y.,20
validated by Motmans R.,1
validated by Moysons P.,30
validated by Muls D.,3
validated by Muraille D.,1
validated by Muusse T.,10
validated by Muylaert B.,1
validated by Mylleville N.,2
validated by Métens A.,2
validated by NP Educatie,7
validated by NP Kanaalregio-BvAa,1
validated by NSG Beneden-Dijle,280
validated by Nabben R.,1
validated by Nachtergaele H.,2
validated by Nachtergaele M.,1
validated by Naeyaert K.,3
validated by Nagelhout A.,2
validated by Nagtegals P.,145
validated by Natuurpunt De Bron,18
validated by Natuurpunt Jabbeke,1
validated by Natuurpunt Kinderdri,2
validated by Natuurpunt Mandelstr,30
validated by Natuurpunt Markvalle,1
validated by Natuurpunt Studie,2
validated by Natuurpunt Zedelgem,1
validated by NatuurstudieWG Vorse,1
validated by Natuurstudiegroep Di,3
validated by Neels T.,2
validated by Nef B.,4
validated by Nelis W.,1
validated by Neujens L.,7
validated by Neukermans A.,12
validated by Neve C.,1
validated by Neymeyr S.,1
validated by Nicaise J-P.,1
validated by Nick W,1
validated by Nick en Marita,428
validated by Nicolai M.,2
validated by Nicolas Breuer,1
validated by Nietvelt H.,10
validated by Nijs G.,27
validated by Nijs J.,2
validated by Nine Van Hoyweghen,1
validated by Noelmans D.,1
validated by Nopenaire C.,1
validated by Noppe F.,1
validated by Nossent R.,24
validated by Notebaert B.,3
validated by Nouls F.,3
validated by Nouws T.,1
validated by Nuttin J.,1
validated by Nuyens C.,5
validated by Nuyts J.,551
validated by Nuyts T.,4
validated by Nys G.,41
validated by Odeur K.,6
validated by Olivier J.-F.,5
validated by Olyslaegers O.,23
validated by Onafhankelyke Vogela,8
validated by Ongena T.,1
validated by Onkelinx C.,19
validated by Onnockx P.,3
validated by Ons Madi,1
validated by Oosterlynck F.,2
validated by Opdenacker E.,25
validated by Opsomer J.,9
validated by Ostyn S.,5
validated by Ottenburghs D.,5
validated by Ottevaere W.,1
validated by Ovaa A.,2
validated by Overweg J.,8
validated by PAGLIANO G,4
validated by PARKER M,32
validated by PASTEELS J,20
validated by PATINY S,846
validated by PAULY A,28460
validated by PETIT J,2116
validated by PNC Limburg,4
validated by PONCHAU O,33
validated by POPELER AS,409
validated by Packet J.,2
validated by Packet W.,1
validated by Paelinckx M.,13
validated by Paenhuysen J.,1
validated by Paepen N.,13
validated by Paes J.,50
validated by Paesen H.,1
validated by Paessens R.,4
validated by Palmans G.,41
validated by Pannier E.,243
validated by Paquay C.,1
validated by Paques H.,16
validated by Paquet A.,25
validated by Paquet J-Y.,1
validated by Parc Naturel des Pla,15
validated by Parmentier M.,3
validated by Parmentier W.,1
validated by Pasau B.,468
validated by Pat VdA,1
validated by Patriek C,1
validated by Paul Matthys,1
validated by Paul en Krista,171
validated by Paul en Marianne,640
validated by Pauly A,5438
validated by Pauwels B.,136
validated by Pauwels C.,6
validated by Pauwels Claude,1
validated by Pauwels J.,6
validated by Peetermans E.,1
validated by Peetermans M.,4
validated by Peeters E.,4
validated by Peeters K.,53
validated by Peeters L.,27
validated by Peeters P.,1
validated by Permantier M.,1
validated by Perremans S.,4
validated by Peter VdV en Ann VL,22
validated by Peter vds,270
validated by Peters M.,1
validated by Petre L.,8
validated by Peuters C.,1
validated by Phaedra Van Driessch,1
validated by Picard N.,14
validated by Piccavet R.,15
validated by Pické C.,4
validated by Pierret S.,2
validated by Piers F.,1
validated by Piesschaert F.,19
"validated by Pieter, D",5
validated by Pieters A.,3
validated by Pieters H.,1
validated by Pieters J.,4
validated by Pieters Y.,7
validated by Pigneur L.M.,1
validated by Pinget J.-F.,1
validated by Pinoy L.,14
validated by Pinseel J.,9
validated by Pintens J.,37
validated by Pirard G.,2
validated by Piron P.,3
validated by Pirotte D.,53
validated by Piryns I.,280
validated by Plaines de l'Escaut,28
validated by Plantenwerkgroep Hol,1
validated by Plantenwerkgroep Oos,1
validated by Platjouw E.,1
validated by Platteau L.,107
validated by Plessers P.,1
validated by Pletinck R.,1
validated by Plu D.,13
validated by Point L.,1
validated by Polfliet R.,1
validated by Pollet D.,1
validated by Poncin J.,23
validated by Poorters H.,3
validated by Poppe M.,6
validated by Poppe- Delmelle,13
validated by Poppe- Delmelle R.,47
validated by Poppe-Delmelle R.,130
validated by Porrez G.,1
validated by Pottier J.,10
validated by Preud'homme J.,291
validated by Priem C.,1
validated by Priem J.,1
validated by Princen Y.,203
validated by Prinsen P.,7
validated by Proesmans W.,227
validated by Projectgroep Levend,41
validated by Provincie Vlaams-Bra,1
validated by Provoost S.,1
validated by Puls R.,67
validated by Pédron M.,112
validated by Q. Philippe,1
validated by QUARANTA M,933
validated by Quaghebeur G.,6
validated by Quartier J.,48
validated by Quentin G.,19
validated by Querinjean L.,1
validated by R. DH,3
validated by RASMONT P,24160
validated by RASMONT P.,6
validated by REINIG W D,2787
validated by REINIG WF,2
validated by REMACLE A,8299
validated by RUWET A,277
validated by Raemakers I.,8
validated by Raes F.,2
validated by Raes K.,1
validated by Raimondi M.,1
validated by Raison G.,1
validated by Raison R.,2
validated by Rampelbergh F.,10
validated by Rans N.,2
validated by Ranson J.,1
validated by Rappé V.,11
validated by Rasmont P,220
validated by Rasmont P.,2
validated by Ravoet J.,13
validated by Raymaekers S.,141
validated by Recour R.,2
validated by Reekmans J.,3
validated by Regent M.,1
validated by Reggers J.,21
validated by Regniers L.,3
validated by Reinehr P.,1
validated by Renders F.,1
validated by Renders J.,1
validated by Renson J.,1
validated by Resseler F.,6
validated by Reuter G.,10
validated by Reychler L.,3
validated by Reynaert K.,15
validated by Reynaerts A.,35
validated by Reyniers J.,5640
validated by Richerzhagen C.,10
validated by Rijmenans G,19
validated by Rijmenans G.,5
validated by Rijmenants A.,2
validated by Rijnen E.,1
validated by Rijnen P.,1
validated by Robbe Cool,1
validated by Robbe I.,11
validated by Robberechts K.,1
validated by Roberts A.,7
validated by Robeyns E.,1
validated by Robijns J.,2
validated by Robise A.,1
validated by Roelandt B.,6
validated by Roelandt L.,62
validated by Roels E.,14
validated by Roesems L.,21
validated by Rogghe M.,560
validated by Rogier T.,1
validated by Rogiers F.,12
validated by Rogiers L.,1
validated by Rolin J-P.,1
validated by Rommens J.,2
validated by Rommens W.,31
validated by Rommes J.,11
validated by Ronald Bontrop,1
validated by Ronse A.,7
validated by Ronsmans J.,54
validated by Ronsmans W.,142
validated by Ronsse E.,11
validated by Rooms E.,2
validated by Roos E.,1
validated by Roos M.,1
validated by Rooseleer G.,9
validated by Roosen H.,3
validated by Roosen Y.,10
validated by Rousseau J./Piot S.,23
validated by Rousseau-Piot J-S.,471
validated by Rousseau-Piot J.-S.,151
validated by Royens B.,17
validated by Rubberecht L.,18
validated by Rubio M.,2
validated by Ruelle B.,5
validated by Rune T.,2
validated by Rutten L.,3
validated by Rutten M.,169
validated by Ruymen J.,3
validated by Ruyts S.,1
validated by Ryckeboer N.,9
validated by Rys J.,3
validated by S. Verheyen,1
validated by SCHWARZ M,1207
validated by SECHE A,1
validated by SPK vzw,3
validated by Sabatino U.,56
validated by Sabine Cr,3
validated by Saerens R.,2
validated by Saey R.,4
validated by Saint-Ghislain M-F.,1
validated by Saint-Ghislain M.-F.,1
validated by Salmon B.,1
validated by Salvo C.,1
validated by Sam & Katrien,6
validated by Sam F.,3
validated by Samoise L.,1
validated by Samyn K.,47
validated by San Martin G.,1
validated by Sanczuk P.,3
validated by Sanders V.,2
validated by Sanne M.,19
validated by Sansen U.,34
validated by Santy G.,1
validated by Schelfhout S.,3
validated by Schepens J.,3
validated by Schepers R.,3
validated by Schepers T.,9
validated by Schild E.,1
validated by Schildermans T.,4
validated by Schleich E.,1
validated by Schneider A.,9
validated by Schoeters F.,47
validated by Schoonvaere K,104
validated by Schoonvaere K.,98
validated by Schouteden M.,2
validated by Schowanek S.,2
validated by Schrans N.,28
validated by Schreven S.,1
validated by Schrooten D.,11
validated by Schuermans J-B.,2
validated by Schuermans P.,1
validated by Schurmans M.,9
validated by Schuttelaar-Stein P.,1
validated by Schuurmans P.,7
validated by Segerink G.,1
validated by Segers M.,8
validated by Segers P.,1
validated by Segers R.,27
validated by Segers S.,12
validated by Segond M.,2
validated by Sels L.,1
validated by Selvais K.,2
validated by Semmouri I.,3
validated by Sercu B.,15
validated by Serein L.,6
validated by Servaes T.,11
validated by Severeyns J.,13
validated by Sevrin D.,85
validated by Seynaeve A.,14
validated by Seynhaeve T.,1
validated by Seys J.,9
validated by Simoens N.,1
validated by Simon M.,1
validated by Simons J.,1
validated by Simons L.,1
validated by Simons-De Roeck F. e,2
validated by Simons-De Roeck F./S,10
validated by Simons-De Roeck Fr./,6
validated by Sinnaeve K.,1
validated by Skoropinski J.,5
validated by Slagmulders E.,6
validated by Sleeuwaert T.,9
validated by Slegers T.,16
validated by Slootmaekers D.,46
validated by Slosse W.,27
validated by Smeets P.,124
validated by Smeets T.,23
validated by Smessaert P.,30
validated by Smets A.,4
validated by Smets D.,5
validated by Smets K.,1
validated by Smets L.,1
validated by Smets W.,7
validated by Smit J,2
validated by Smit J.T.,10
validated by Smith R.,6
validated by Smits P.,390
validated by Smits P./Vandenbergh,1316
